{
  "$schema": "schemas/ci-evidence-plan.schema.json",
  "schemaVersion": 1,
  "kind": "deep-audit-ci-evidence-plan",
  "matrixSource": "scripts/audit-coverage-matrix.mjs",
  "observation": {
    "maxAgeSeconds": 900,
    "noncePattern": "^[0-9a-f]{8}-[0-9a-f]{4}-4[0-9a-f]{3}-[89ab][0-9a-f]{3}-[0-9a-f]{12}$",
    "noModelOverrides": true,
    "canonicalInputs": [
      {"name": "inventory", "path": "infra/governance/inventory/managed-repos.json"},
      {"name": "desired", "path": "infra/governance/desired/github.json"},
      {"name": "rings", "path": "infra/governance/release-rings.json"},
      {"name": "certifications", "path": "infra/governance/providers/certifications.json"},
      {"name": "compatibility", "path": "infra/governance/providers/compatibility-matrix.json"},
      {"name": "issuers", "path": "infra/governance/trust/issuers.json"},
      {"name": "waivers", "path": "infra/governance/waivers.json"},
      {"name": "runtimeProfile", "path": "infra/governance/providers/runtime-conformance.json"},
      {"name": "externalActivationRequirements", "path": "infra/governance/external-activation-requirements.json"},
      {"name": "externalActivationPolicy", "path": "infra/governance/external-activation-policy.json"},
      {"name": "githubMutationBoundaryContract", "path": "infra/governance/providers/github-mutation-boundary-contract.json"},
      {"name": "releaseTagAuthorizationPolicy", "path": "infra/governance/release-tag-authorization-policy.json"}
    ],
    "consumerChecks": [
      {"id": "audit", "workflow": ".github/workflows/audit.yml", "checkName": "audit"},
      {"id": "visual", "workflow": ".github/workflows/audit.yml", "checkName": "visual"}
    ]
  },
  "dimensions": [
    {
      "dim": 64,
      "id": "DS-DIM-064",
      "tier": "CI-ENFORCED",
      "mechanism": "standard five-step live observation:PR tree=squash-merge tree=tag tree + immutable release/BOM/npm provenance;no candidate freeze,external activation,offline attestor,or import ceremony",
      "capability": "protected-release-propagation",
      "subject": {
        "repositoryRole": "authority",
        "workflow": ".github/workflows/release.yml",
        "checkName": "Protected release propagation"
      },
      "coverage": {
        "envelope": "frozen-rubric",
        "requiredPaths": [
          ".github/workflows/mirror-to-published-template.yml",
          ".github/workflows/release.yml",
          "infra/governance/bin/consumerctl.mjs",
          "infra/governance/bin/reconcile-github.mjs",
          "infra/governance/desired/github.json",
          "infra/governance/external-activation-policy.json",
          "infra/governance/external-activation-requirements.json",
          "infra/governance/inventory/managed-repos.json",
          "infra/governance/lib/check-run-trust.mjs",
          "infra/governance/lib/external-activation.mjs",
          "infra/governance/lib/fleet-reconcile-mirror.mjs",
          "infra/governance/lib/issuer-registry.mjs",
          "infra/governance/lib/release-evidence.mjs",
          "infra/governance/lib/release-tag-authorization.mjs",
          "infra/governance/lib/release-trust-preflight.mjs",
          "infra/governance/lib/rollout-state-machine.mjs",
          "infra/governance/lib/runtime-certification.mjs",
          "infra/governance/lib/signed-release-tag.mjs",
          "infra/governance/lib/staged-rollout.mjs",
          "infra/governance/lib/workflow-trust.mjs",
          "infra/governance/providers/certifications.json",
          "infra/governance/providers/compatibility-matrix.json",
          "infra/governance/providers/github-mutation-boundary-contract.json",
          "infra/governance/providers/runtime-conformance.json",
          "infra/governance/release-rings.json",
          "infra/governance/release-tag-authorization-policy.json",
          "infra/governance/schemas/external-activation-policy.schema.json",
          "infra/governance/schemas/external-activation-requirements.schema.json",
          "infra/governance/schemas/github-mutation-boundary-contract.schema.json",
          "infra/governance/schemas/release-tag-authorization-policy.schema.json",
          "infra/governance/schemas/release-tag-authorization.schema.json",
          "infra/governance/schemas/release-trust-preflight-evidence.schema.json",
          "infra/governance/test/release-tag-authorization.test.mjs",
          "infra/governance/test/release-trust-preflight.test.mjs",
          "infra/governance/test/signed-release-tag.test.mjs",
          "infra/governance/trust/issuers.json",
          "infra/governance/waivers.json",
          "scripts/build-published-template-mirror.mjs",
          "scripts/check-branch-protection.mjs",
          "scripts/ci-evidence-plan.json",
          "scripts/generate-product-template-package-lock.mjs",
          "scripts/lib/branch-protection-policy.mjs",
          "scripts/lib/ci-evidence-live-observer.mjs",
          "scripts/lib/ci-evidence-pipeline.mjs",
          "scripts/lib/ci-evidence-plan.mjs",
          "scripts/lib/deep-audit-evidence-contract.mjs",
          "scripts/lib/github-actions-artifact-identity.mjs",
          "scripts/lib/github-mutation-boundary.mjs",
          "scripts/lib/governance-dependency-bootstrap.mjs",
          "scripts/lib/published-template-provider-surfaces.mjs",
          "scripts/lib/runtime-dependency-closure.mjs",
          "scripts/mirror-run-artifact-identity.mjs",
          "scripts/produce-ci-enforced-evidence.mjs",
          "scripts/product-template-scaffold-lock.mjs",
          "scripts/release-bom-contract.mjs",
          "scripts/release-tag-authorization.mjs",
          "scripts/release-trust-preflight.mjs",
          "scripts/schemas/ci-evidence-attestation.schema.json",
          "scripts/schemas/ci-evidence-observation.schema.json",
          "scripts/schemas/ci-evidence-plan.schema.json",
          "scripts/setup-governance.mjs",
          "scripts/test-check-branch-protection.mjs",
          "scripts/test-mirror-run-artifact-identity.mjs",
          "scripts/test-product-template-scaffold-lock.mjs",
          "scripts/test-verify-mirror-activation-boundary.mjs",
          "scripts/test-verify-mirror-evidence.mjs",
          "scripts/test-verify-mirror-release.mjs",
          "scripts/verify-mirror-activation-boundary.mjs",
          "scripts/verify-mirror-evidence.mjs",
          "scripts/verify-mirror-release.mjs",
          "scripts/verify-upgrade-provenance.mjs"
        ]
      },
      "requirements": [
        "active-run-head-tree-manifest",
        "protected-remote-head-tree",
        "rulesets-required-check-producer",
        "exact-workflow-run-identity",
        "immutable-release-bom-tag",
        "template-fleet-exact-version"
      ]
    },
    {
      "dim": 66,
      "id": "DS-DIM-066",
      "tier": "CI-ENFORCED",
      "mechanism": "repository_dispatch mirror + exact template/work-management lockfiles and Verify consumer required checks;dim64/66 share one atomic live-observation digest",
      "capability": "cross-repo-visual-parity",
      "subject": {
        "repositoryRole": "authority",
        "workflow": ".github/workflows/mirror-to-published-template.yml",
        "checkName": "Cross-repo visual parity"
      },
      "coverage": {
        "envelope": "frozen-rubric",
        "requiredPaths": [
          ".github/workflows/composition-fidelity.yml",
          ".github/workflows/mirror-to-published-template.yml",
          "infra/governance/bin/consumerctl.mjs",
          "infra/governance/bin/reconcile-github.mjs",
          "infra/governance/desired/github.json",
          "infra/governance/external-activation-policy.json",
          "infra/governance/external-activation-requirements.json",
          "infra/governance/inventory/managed-repos.json",
          "infra/governance/lib/check-run-trust.mjs",
          "infra/governance/lib/external-activation.mjs",
          "infra/governance/lib/issuer-registry.mjs",
          "infra/governance/lib/release-evidence.mjs",
          "infra/governance/lib/release-tag-authorization.mjs",
          "infra/governance/lib/release-trust-preflight.mjs",
          "infra/governance/lib/runtime-certification.mjs",
          "infra/governance/lib/signed-release-tag.mjs",
          "infra/governance/lib/workflow-trust.mjs",
          "infra/governance/providers/certifications.json",
          "infra/governance/providers/compatibility-matrix.json",
          "infra/governance/providers/github-mutation-boundary-contract.json",
          "infra/governance/providers/runtime-conformance.json",
          "infra/governance/release-rings.json",
          "infra/governance/release-tag-authorization-policy.json",
          "infra/governance/schemas/external-activation-policy.schema.json",
          "infra/governance/schemas/external-activation-requirements.schema.json",
          "infra/governance/schemas/github-mutation-boundary-contract.schema.json",
          "infra/governance/schemas/release-tag-authorization-policy.schema.json",
          "infra/governance/schemas/release-tag-authorization.schema.json",
          "infra/governance/schemas/release-trust-preflight-evidence.schema.json",
          "infra/governance/test/release-tag-authorization.test.mjs",
          "infra/governance/test/release-trust-preflight.test.mjs",
          "infra/governance/test/signed-release-tag.test.mjs",
          "infra/governance/trust/issuers.json",
          "infra/governance/waivers.json",
          "scripts/build-published-template-mirror.mjs",
          "scripts/check-branch-protection.mjs",
          "scripts/ci-evidence-plan.json",
          "scripts/composition-fidelity-visual-diff.mjs",
          "scripts/dogfood-prepublish-verify.mjs",
          "scripts/generate-product-template-package-lock.mjs",
          "scripts/lib/branch-protection-policy.mjs",
          "scripts/lib/ci-evidence-live-observer.mjs",
          "scripts/lib/ci-evidence-pipeline.mjs",